{
  "$schema": "./integration_manifest.schema.json",
  "version": "1.0.0",
  "description": "Grey Multi-Tenant Platform - SDK Integration Manifest",
  "generatedAt": "2026-01-26T00:00:00Z",
  "adapterCore": {
    "source": "packages/grey-adapters/src/adapter_core.ts",
    "domains": ["auth", "user", "projects", "query", "mutation"]
  },
  "transports": {
    "httpJson": {
      "gateway": "packages/grey-adapters/src/http_gateway/index.ts",
      "baseUrl": "/api/v1",
      "contentType": "application/json"
    },
    "grpc": {
      "service": "packages/grey-adapters/src/grpc_service/index.ts",
      "protoPath": "packages/grey-adapters/src/grpc_service/proto",
      "packages": [
        "grey.auth.v1",
        "grey.user.v1",
        "grey.projects.v1",
        "grey.query.v1",
        "grey.mutation.v1"
      ]
    }
  },
  "domainSurface": {
    "auth": {
      "operations": [
        { "name": "login", "method": "POST", "path": "/auth/login", "grpc": "AuthService/Login" },
        { "name": "logout", "method": "POST", "path": "/auth/logout", "grpc": "AuthService/Logout" },
        { "name": "refresh", "method": "POST", "path": "/auth/refresh", "grpc": "AuthService/Refresh" }
      ]
    },
    "user": {
      "operations": [
        { "name": "getCurrentUser", "method": "GET", "path": "/users/me", "grpc": "UserService/GetCurrentUser" },
        { "name": "getUser", "method": "GET", "path": "/users/:userId", "grpc": "UserService/GetUser" }
      ]
    },
    "projects": {
      "operations": [
        { "name": "listProjects", "method": "GET", "path": "/projects", "grpc": "ProjectsService/ListProjects" },
        { "name": "createProject", "method": "POST", "path": "/projects", "grpc": "ProjectsService/CreateProject" }
      ]
    },
    "query": {
      "operations": [
        { "name": "query", "method": "POST", "path": "/query", "grpc": "QueryService/Query" }
      ]
    },
    "mutation": {
      "operations": [
        { "name": "mutate", "method": "POST", "path": "/mutate", "grpc": "MutationService/Mutate" }
      ]
    }
  },
  "ecosystems": [
    {
      "id": "grey-angular",
      "name": "Angular",
      "package": "packages/grey-angular",
      "transport": "http-json",
      "language": "typescript",
      "domainClients": ["auth", "user", "projects", "query", "mutation"],
      "fileStructure": {
        "src": {
          "lib": {
            "services": ["auth.service.ts", "user.service.ts", "projects.service.ts", "query.service.ts", "mutation.service.ts"],
            "models": ["*.model.ts"],
            "interceptors": ["auth.interceptor.ts", "error.interceptor.ts"]
          }
        }
      },
      "entrypoint": "src/public-api.ts"
    },
    {
      "id": "grey-react",
      "name": "React",
      "package": "packages/grey-react",
      "transport": "http-json",
      "language": "typescript",
      "domainClients": ["auth", "user", "projects", "query", "mutation"],
      "fileStructure": {
        "src": {
          "hooks": ["useAuth.ts", "useUser.ts", "useProjects.ts", "useQuery.ts", "useMutation.ts"],
          "client": ["grey-client.ts"],
          "types": ["*.ts"]
        }
      },
      "entrypoint": "src/index.ts"
    },
    {
      "id": "grey-vue",
      "name": "Vue",
      "package": "packages/grey-vue",
      "transport": "http-json",
      "language": "typescript",
      "domainClients": ["auth", "user", "projects", "query", "mutation"],
      "fileStructure": {
        "src": {
          "composables": ["useAuth.ts", "useUser.ts", "useProjects.ts", "useQuery.ts", "useMutation.ts"],
          "client": ["grey-client.ts"],
          "types": ["*.ts"]
        }
      },
      "entrypoint": "src/index.ts"
    },
    {
      "id": "grey-svelte",
      "name": "Svelte",
      "package": "packages/grey-svelte",
      "transport": "http-json",
      "language": "typescript",
      "domainClients": ["auth", "user", "projects", "query", "mutation"],
      "fileStructure": {
        "src": {
          "stores": ["auth.ts", "user.ts", "projects.ts"],
          "client": ["grey-client.ts"]
        }
      },
      "entrypoint": "src/index.ts"
    },
    {
      "id": "grey-solid",
      "name": "Solid",
      "package": "packages/grey-solid",
      "transport": "http-json",
      "language": "typescript",
      "domainClients": ["auth", "user", "projects", "query", "mutation"],
      "fileStructure": {
        "src": {
          "hooks": ["createAuth.ts", "createUser.ts", "createProjects.ts"],
          "client": ["grey-client.ts"]
        }
      },
      "entrypoint": "src/index.ts"
    },
    {
      "id": "grey-qwik",
      "name": "Qwik",
      "package": "packages/grey-qwik",
      "transport": "http-json",
      "language": "typescript",
      "domainClients": ["auth", "user", "projects", "query", "mutation"],
      "fileStructure": {
        "src": {
          "hooks": ["use-auth.ts", "use-user.ts", "use-projects.ts"],
          "client": ["grey-client.ts"]
        }
      },
      "entrypoint": "src/index.ts"
    },
    {
      "id": "grey-preact",
      "name": "Preact",
      "package": "packages/grey-preact",
      "transport": "http-json",
      "language": "typescript",
      "domainClients": ["auth", "user", "projects", "query", "mutation"],
      "fileStructure": {
        "src": {
          "hooks": ["useAuth.ts", "useUser.ts", "useProjects.ts"],
          "client": ["grey-client.ts"]
        }
      },
      "entrypoint": "src/index.ts"
    },
    {
      "id": "grey-lit",
      "name": "Lit",
      "package": "packages/grey-lit",
      "transport": "http-json",
      "language": "typescript",
      "domainClients": ["auth", "user", "projects", "query", "mutation"],
      "fileStructure": {
        "src": {
          "controllers": ["auth-controller.ts", "user-controller.ts", "projects-controller.ts"],
          "client": ["grey-client.ts"]
        }
      },
      "entrypoint": "src/index.ts"
    },
    {
      "id": "grey-stencil",
      "name": "Stencil",
      "package": "packages/grey-stencil",
      "transport": "http-json",
      "language": "typescript",
      "domainClients": ["auth", "user", "projects", "query", "mutation"],
      "fileStructure": {
        "src": {
          "services": ["auth-service.ts", "user-service.ts", "projects-service.ts"],
          "client": ["grey-client.ts"]
        }
      },
      "entrypoint": "src/index.ts"
    },
    {
      "id": "grey-vanilla",
      "name": "Vanilla JS",
      "package": "packages/grey-vanilla",
      "transport": "http-json",
      "language": "typescript",
      "domainClients": ["auth", "user", "projects", "query", "mutation"],
      "fileStructure": {
        "src": {
          "client": ["grey-client.ts"],
          "domain": ["auth-client.ts", "user-client.ts", "projects-client.ts", "query-client.ts", "mutation-client.ts"]
        }
      },
      "entrypoint": "src/index.ts"
    },
    {
      "id": "grey-next",
      "name": "Next.js",
      "package": "packages/grey-next",
      "transport": "http-json",
      "language": "typescript",
      "domainClients": ["auth", "user", "projects", "query", "mutation"],
      "fileStructure": {
        "src": {
          "client": ["grey-client.ts"],
          "server": ["grey-server.ts"],
          "hooks": ["useAuth.ts", "useUser.ts", "useProjects.ts"]
        }
      },
      "entrypoint": "src/index.ts"
    },
    {
      "id": "grey-nuxt",
      "name": "Nuxt",
      "package": "packages/grey-nuxt",
      "transport": "http-json",
      "language": "typescript",
      "domainClients": ["auth", "user", "projects", "query", "mutation"],
      "fileStructure": {
        "src": {
          "composables": ["useAuth.ts", "useUser.ts", "useProjects.ts"],
          "plugins": ["grey.ts"]
        }
      },
      "entrypoint": "src/module.ts"
    },
    {
      "id": "grey-remix",
      "name": "Remix",
      "package": "packages/grey-remix",
      "transport": "http-json",
      "language": "typescript",
      "domainClients": ["auth", "user", "projects", "query", "mutation"],
      "fileStructure": {
        "src": {
          "client": ["grey-client.ts"],
          "server": ["grey-server.ts"],
          "hooks": ["useAuth.ts", "useUser.ts"]
        }
      },
      "entrypoint": "src/index.ts"
    },
    {
      "id": "grey-astro",
      "name": "Astro",
      "package": "packages/grey-astro",
      "transport": "http-json",
      "language": "typescript",
      "domainClients": ["auth", "user", "projects", "query", "mutation"],
      "fileStructure": {
        "src": {
          "client": ["grey-client.ts"],
          "integration": ["index.ts"]
        }
      },
      "entrypoint": "src/index.ts"
    },
    {
      "id": "grey-sveltekit",
      "name": "SvelteKit",
      "package": "packages/grey-sveltekit",
      "transport": "http-json",
      "language": "typescript",
      "domainClients": ["auth", "user", "projects", "query", "mutation"],
      "fileStructure": {
        "src": {
          "lib": {
            "stores": ["auth.ts", "user.ts", "projects.ts"],
            "server": ["grey-server.ts"]
          }
        }
      },
      "entrypoint": "src/lib/index.ts"
    },
    {
      "id": "grey-node",
      "name": "Node.js",
      "package": "packages/grey-node",
      "transport": "grpc",
      "language": "typescript",
      "domainClients": ["auth", "user", "projects", "query", "mutation"],
      "fileStructure": {
        "src": {
          "grpc": ["auth-service.ts", "user-service.ts", "projects-service.ts", "query-service.ts", "mutation-service.ts"],